{
  "report_version": "1.0",
  "agent_role": "FIRST_PRINCIPLES_PHYSICS_AUDITOR",
  "repo_snapshot": {
    "files_scanned": [
      "README.md",
      "pyproject.toml",
      "Makefile",
      "AGENTS.md",
      "CLAIMS.md",
      "FORBIDDEN_CLAIMS.md",
      "docs/REPOSITORY_SYSTEM.md",
      "docs/CME_ITERATION_0001.json",
      "tools/research/research_cli.py",
      "tools/research/validate_cme_iteration_contract.py"
    ],
    "missing_expected_files": [
      "cme/** package or module path",
      "python -m cme.cli entrypoint",
      "examples/problems/ai_system_design.txt",
      "benchmarks/CME benchmark harness",
      "prompts/** canonical prompt surface",
      "artifacts/cme/** evidence bundle for CME iterations",
      "persisted trajectory trace contract with state_t/state_t_plus_1 fields"
    ],
    "detected_entrypoints": [
      "geosync-research = tools.research.research_cli:main",
      "mfn = geosync.mfn.cli:main",
      "mfn-api = geosync.mfn.cli:api_main",
      "mfn-validate = geosync.mfn.cli:validate_main",
      "geosync-release-gate = scripts.ci.release_gate:main"
    ],
    "detected_tests": [
      "tests/research/test_cme_iteration_contract.py",
      "tests/tools/test_research_cli.py",
      "tests/research_lines/test_ricci_artifact_schema.py",
      "tests/unit/geosync/features/test_features.py"
    ],
    "detected_schemas": [
      "schemas/research/research_inference_artifact.schema.json",
      "schemas/physics_boundary_report.schema.json"
    ],
    "detected_docs": [
      "README.md",
      "AGENTS.md",
      "CLAIMS.md",
      "FORBIDDEN_CLAIMS.md",
      "docs/REPOSITORY_SYSTEM.md",
      "docs/CME_PHYSICS_RND_LOOP.md",
      "docs/CME_ITERATION_0001.json"
    ]
  },
  "system_identity": {
    "system_type": "Verification-first quantitative research platform with CME governance layer and MFN dependency-light gateway.",
    "core_transformation": "research intent and data/config inputs -> schema-bound artifacts, claim tiers, falsifiers, validation reports, and release evidence.",
    "input_state": "raw research line, repository context, candidate agent plan, data/config paths, and claim text.",
    "output_state": "validated or rejected artifact/report with explicit status tier, replay path, and handoff.",
    "validation_boundary": "README, CLAIMS, FORBIDDEN_CLAIMS, AGENTS, schemas, tests, CLI gates, and release evidence harness."
  },
  "state_model": {
    "state_variables": [
      {
        "name": "intent_state",
        "definition": "Compressed goal for one iteration or research line.",
        "repo_evidence": [
          "docs/CME_ITERATION_0001.json:first_missing_condition",
          "AGENTS.md:Required Behavior"
        ],
        "status": "S0_REPO_FACT"
      },
      {
        "name": "context_state",
        "definition": "Repository files and canonical surfaces used as the boundary for the operation.",
        "repo_evidence": [
          "docs/REPOSITORY_SYSTEM.md:Canonical Surfaces",
          "README.md:Repository Map"
        ],
        "status": "S0_REPO_FACT"
      },
      {
        "name": "candidate_state",
        "definition": "Agent-generated plan, patch, or hypothesis before verifier approval.",
        "repo_evidence": [
          "docs/CME_ITERATION_0001.json:agent_plan"
        ],
        "status": "S5_PROXY"
      },
      {
        "name": "claim_state",
        "definition": "Claim text plus status tier, evidence pointer, and falsifier boundary.",
        "repo_evidence": [
          "CLAIMS.md:Active claims",
          "FORBIDDEN_CLAIMS.md:Promotion Invariants"
        ],
        "status": "S0_REPO_FACT"
      },
      {
        "name": "evidence_state",
        "definition": "Artifact, raw logs, exit codes, schema result, hashes, replay command, and manifest.",
        "repo_evidence": [
          "AGENTS.md:Release Rule",
          "README.md:Release Evidence Harness"
        ],
        "status": "S0_REPO_FACT"
      },
      {
        "name": "gate_state",
        "definition": "Verifier decision surface: pass, fail, reroute, or block promotion.",
        "repo_evidence": [
          "Makefile:test",
          "Makefile:lint",
          "scripts/ci/check_claim_boundary.py"
        ],
        "status": "S0_REPO_FACT"
      },
      {
        "name": "artifact_state",
        "definition": "Committed or generated JSON/markdown output with schema and replay contract.",
        "repo_evidence": [
          "schemas/research/research_inference_artifact.schema.json",
          "artifacts/runs/ricci_microstructure_v1/example_artifact.json"
        ],
        "status": "S0_REPO_FACT"
      },
      {
        "name": "verification_state",
        "definition": "Observed command result and gate evidence. Present as intended command surface; not observed for this Role 1 patch inside this connector session.",
        "repo_evidence": [
          "docs/CME_ITERATION_0001.json:validation_commands",
          "Makefile:test"
        ],
        "status": "S5_PROXY"
      },
      {
        "name": "release_state",
        "definition": "Release verdict plus evidence bundle; documented but not complete for CME boundary audit.",
        "repo_evidence": [
          "AGENTS.md:Release Rule",
          "README.md:Release Evidence Harness"
        ],
        "status": "S5_PROXY"
      }
    ]
  },
  "constraints": {
    "boundary_conditions": [
      "No claim without tier, evidence pointer, falsifier, and replay path.",
      "Synthetic or placeholder artifacts cannot promote research status.",
      "Schema validity proves shape only, not empirical truth.",
      "CME agent output remains residual until a deterministic verifier accepts it.",
      "Release status requires persisted evidence, not terminal success text."
    ],
    "forbidden_claims": [
      "Any wording blocked by FORBIDDEN_CLAIMS.md.",
      "Any product claim that rewrites GeoSync into a live trading, advice, or alpha product.",
      "Any CME claim that describes autonomous intelligence, consciousness, brain measurement, diagnosis, or therapy.",
      "Any prestige-quality claim not translated into explicit gates and evidence."
    ],
    "non_scope": [
      "No feature design by Role 1.",
      "No empirical market performance claim.",
      "No brain or cognitive measurement claim.",
      "No replacement of human responsibility with LLM judgement.",
      "No release promotion without executed commands and artifact bundle."
    ]
  },
  "invariants": [
    {
      "name": "intent coherence",
      "must_conserve": "Each iteration must preserve one primary goal and one first missing condition.",
      "how_verified": "docs/CME_ITERATION_0001.json plus validator checks non-empty singular first_missing_condition.",
      "failure_if_broken": "Agent loop splits into parallel priorities and loses measurable progress."
    },
    {
      "name": "claim status traceability",
      "must_conserve": "Every claim must keep its tier and evidence boundary.",
      "how_verified": "CLAIMS.md, FORBIDDEN_CLAIMS.md, and claim boundary scripts.",
      "failure_if_broken": "Hypothesis wording becomes unsupported promotion."
    },
    {
      "name": "source traceability",
      "must_conserve": "Evidence-bearing outputs must point to source files, artifacts, schemas, and commands.",
      "how_verified": "AGENTS.md evidence-bearing artifact minimum and release rule.",
      "failure_if_broken": "A result cannot be replayed or independently audited."
    },
    {
      "name": "artifact reproducibility",
      "must_conserve": "Artifacts must include deterministic hashes, seed, timestamp, schema, and replay command where evidence-bearing.",
      "how_verified": "research_inference_artifact schema and geosync-research verify path.",
      "failure_if_broken": "Output becomes a screenshot-grade claim rather than a reproducible artifact."
    },
    {
      "name": "human responsibility",
      "must_conserve": "LLM and agents propose candidates; humans remain accountable for high-stakes interpretation and release.",
      "how_verified": "AGENTS.md root contract and claim boundary language.",
      "failure_if_broken": "LLM judgement is incorrectly treated as final truth."
    },
    {
      "name": "proxy honesty",
      "must_conserve": "Proxy metrics and synthetic plumbing must be labeled as proxy/instrumented, not measured truth.",
      "how_verified": "README synthetic-data promotion rule and FORBIDDEN_CLAIMS promotion invariants.",
      "failure_if_broken": "Operational heuristics are misreported as physical measurement."
    },
    {
      "name": "validation evidence",
      "must_conserve": "PASS requires commands, raw logs, exit codes, schema validation, and evidence bundle when release status is claimed.",
      "how_verified": "README release evidence harness and AGENTS.md release rule.",
      "failure_if_broken": "Green console output masquerades as release proof."
    }
  ],
  "operator_map": [
    {
      "operator_name": "ClaimBoundaryOperator",
      "repo_location": "FORBIDDEN_CLAIMS.md; scripts/ci/check_claim_boundary.py",
      "input_state": "claim_state",
      "operation": "reject unreviewed product/status wording and enforce promotion invariants",
      "output_state": "accepted_or_blocked_claim_state",
      "validator": "scripts/ci/check_claim_boundary.py",
      "failure_mode": "unsupported claim enters public docs",
      "decision": "KEEP"
    },
    {
      "operator_name": "ResearchGatewayOperator",
      "repo_location": "tools/research/research_cli.py",
      "input_state": "data_path + config_path + research_line",
      "operation": "stamp provenance and validate schema-bound artifact",
      "output_state": "hypothesis-tier research artifact",
      "validator": "geosync-research verify",
      "failure_mode": "placeholder score is misread as measured result",
      "decision": "KEEP"
    },
    {
      "operator_name": "MFNGatewayOperator",